{
  "active_window": {
    "end_frame": 15,
    "start_frame": 0
  },
  "damage": 0,
  "events": [],
  "frame_count": 16,
  "hitboxes": [],
  "hitstop_frames": 0,
  "move_id": "miduo_blue_run",
  "move_type": "locomotion",
  "multi_hit": false,
  "schema_version": "0.3",
  "state_context_override": "walk"
}
