{
  "active_frames": 7,
  "active_window": {
    "end_frame": 6,
    "start_frame": 0
  },
  "damage": 0,
  "events": [],
  "frame_count": 7,
  "hitboxes": [],
  "hitstop_frames": 0,
  "move_id": "miduo_dead",
  "move_type": "reaction",
  "multi_hit": false,
  "recovery_frames": 0,
  "schema_version": "0.3",
  "startup_frames": 0,
  "state_context_override": "dead"
}
