{
  "active_frames": 6,
  "active_window": {
    "end_frame": 5,
    "start_frame": 0
  },
  "damage": 0,
  "events": [],
  "frame_count": 6,
  "hitboxes": [],
  "hitstop_frames": 0,
  "move_id": "miduo_fight_idle",
  "move_type": "utility",
  "multi_hit": false,
  "recovery_frames": 0,
  "schema_version": "0.3",
  "startup_frames": 0,
  "state_context_override": "idle"
}
