{
	"active_window": {
		"end_frame": 3,
		"start_frame": 0
	},
	"damage": 0,
	"events": [
		{
			"event_type": "set_velocity",
			"frame": 0,
			"payload": {
				"x": 160,
				"y": 0
			}
		},
		{
			"event_type": "set_velocity",
			"frame": 3,
			"payload": {
				"x": 0,
				"y": 0
			}
		}
	],
	"frame_count": 4,
	"hitboxes": [],
	"hitstop_frames": 0,
	"move_id": "dash",
	"move_type": "locomotion",
	"multi_hit": false,
	"schema_version": "0.3",
	"state_context_override": "dash"
}
