{
	"active_window": {
		"end_frame": 5,
		"start_frame": 0
	},
	"damage": 0,
	"events": [
		{
			"event_type": "change_state_context",
			"frame": 5,
			"payload": {
				"state": "idle"
			}
		}
	],
	"frame_count": 6,
	"hitboxes": [],
	"hitstop_frames": 0,
	"move_id": "hurt_heavy",
	"move_type": "reaction",
	"multi_hit": false,
	"schema_version": "0.3",
	"state_context_override": "hurt"
}
