{
  "active_window": {
    "end_frame": 2,
    "start_frame": 0
  },
  "damage": 0,
  "events": [],
  "frame_count": 3,
  "hitboxes": [],
  "hitstop_frames": 0,
  "move_id": "miduo_blue_hurt",
  "move_type": "reaction",
  "multi_hit": false,
  "schema_version": "0.3",
  "state_context_override": "hurt"
}
