{
	"active_window": {
		"end_frame": 7,
		"start_frame": 4
	},
	"damage": 13,
	"events": [
		{
			"event_type": "enable_hitbox",
			"frame": 4,
			"payload": {
				"hitbox_id": "hit_round_kick"
			}
		},
		{
			"event_type": "disable_hitbox",
			"frame": 7,
			"payload": {
				"hitbox_id": "hit_round_kick"
			}
		},
		{
			"event_type": "apply_hitstop",
			"frame": 7,
			"payload": {
				"frames": 4
			}
		}
	],
	"frame_count": 10,
	"hitboxes": [
		{
			"active_window": {
				"end_frame": 7,
				"start_frame": 4
			},
			"hitbox_id": "hit_round_kick",
			"rect": {
				"h": 16,
				"w": 42,
				"x": 10,
				"y": -28
			}
		}
	],
	"hitstop_frames": 4,
	"move_id": "round_kick",
	"move_type": "combat",
	"multi_hit": false,
	"schema_version": "0.3",
	"state_context_override": "idle"
}
